<?xml version="1.0" encoding="utf-8"?>
<xs:schema xmlns:xsi="http://www.w3.org/2001/XMLSchema-instance" attributeFormDefault="unqualified" elementFormDefault="qualified" xmlns:xs="http://www.w3.org/2001/XMLSchema">
	<xs:element name="list">
		<xs:complexType>
			<xs:sequence>
				<xs:element maxOccurs="unbounded" name="item">
					<xs:complexType>
						<xs:sequence>
							<xs:choice maxOccurs="unbounded">
								<xs:element maxOccurs="unbounded" name="set">
									<xs:complexType>
										<xs:attribute name="name" type="xs:string" use="required" />
										<xs:attribute name="val" type="xs:string" use="required" />
									</xs:complexType>
								</xs:element>
								<xs:element name="skills">
									<xs:complexType>
										<xs:sequence>
											<xs:element maxOccurs="unbounded" name="skill">
												<xs:complexType>
													<xs:attribute name="id" type="xs:unsignedShort" use="required" />
													<xs:attribute name="level" type="xs:unsignedByte" use="required" />
													<xs:attribute name="type" type="xs:string" use="optional" />
													<xs:attribute name="type_value" type="xs:unsignedByte" use="optional" />
													<xs:attribute name="type_chance" type="xs:unsignedByte" use="optional" />
												</xs:complexType>
											</xs:element>
										</xs:sequence>
									</xs:complexType>
								</xs:element>
								<xs:element name="stats">
									<xs:complexType>
										<xs:sequence>
											<xs:element maxOccurs="unbounded" name="stat">
												<xs:complexType>
													<xs:simpleContent>
														<xs:extension base="xs:decimal">
															<xs:attribute name="type" type="xs:string" use="required" />
														</xs:extension>
													</xs:simpleContent>
												</xs:complexType>
											</xs:element>
										</xs:sequence>
									</xs:complexType>
								</xs:element>
								<xs:element name="cond">
									<xs:complexType>
										<xs:sequence>
											<xs:element minOccurs="0" name="target">
												<xs:complexType>
													<xs:attribute name="levelRange" type="xs:string" use="required" />
												</xs:complexType>
											</xs:element>
											<xs:element minOccurs="0" name="and">
												<xs:complexType>
													<xs:sequence>
														<xs:element maxOccurs="unbounded" name="player">
															<xs:complexType>
																<xs:attribute name="castle" type="xs:byte" use="optional" />
																<xs:attribute name="pledgeClass" type="xs:byte" use="optional" />
															</xs:complexType>
														</xs:element>
													</xs:sequence>
												</xs:complexType>
											</xs:element>
											<xs:element minOccurs="0" name="player">
												<xs:complexType>
													<xs:attribute name="flyMounted" type="xs:boolean" use="optional" />
													<xs:attribute name="isHero" type="xs:boolean" use="optional" />
													<xs:attribute name="sex" type="xs:unsignedByte" use="optional" />
													<xs:attribute name="level" type="xs:unsignedByte" use="optional" />
													<xs:attribute name="chaotic" type="xs:boolean" use="optional" />
													<xs:attribute name="levelRange" type="xs:string" use="optional" />
													<xs:attribute name="insideZoneId" type="xs:string" use="optional" />
												</xs:complexType>
											</xs:element>
										</xs:sequence>
										<xs:attribute name="addName" type="xs:unsignedByte" use="optional" />
										<xs:attribute name="msgId" type="xs:unsignedShort" use="required" />
									</xs:complexType>
								</xs:element>
								<xs:element name="capsuled_items">
									<xs:complexType mixed="true">
										<xs:sequence>
											<xs:element maxOccurs="unbounded" name="item">
												<xs:complexType>
													<xs:attribute name="id" type="xs:unsignedInt" use="required" />
													<xs:attribute name="min" type="xs:unsignedInt" use="required" />
													<xs:attribute name="max" type="xs:unsignedInt" use="required" />
													<xs:attribute name="chance" type="xs:decimal" use="required" />
													<xs:attribute name="minEnchant" type="xs:unsignedByte" use="optional" />
													<xs:attribute name="maxEnchant" type="xs:unsignedByte" use="optional" />
												</xs:complexType>
											</xs:element>
										</xs:sequence>
									</xs:complexType>
								</xs:element>
							</xs:choice>
						</xs:sequence>
						<xs:attribute name="id" type="xs:unsignedInt" use="required" />
						<xs:attribute name="name" type="xs:string" use="required" />
						<xs:attribute name="type" type="xs:string" use="required" />
						<xs:attribute name="additionalName" type="xs:string" use="optional" />
					</xs:complexType>
				</xs:element>
			</xs:sequence>
		</xs:complexType>
	</xs:element>
</xs:schema>