<?xml version="1.0" encoding="UTF-8"?>
<list xmlns:xsi="http://www.w3.org/2001/XMLSchema-instance" xsi:noNamespaceSchemaLocation="../../xsd/items.xsd">
	<item id="99026" name="Christmas Cube (Time-limited)" additionalName="Sealed" type="EtcItem">
		<!-- Double-click to obtain Christmas Sack. -->
		<set name="icon" val="icon.etc_11th_event_group" />
		<set name="immediate_effect" val="true" />
		<set name="material" val="PAPER" />
		<set name="is_tradable" val="false" />
		<set name="is_dropable" val="false" />
		<set name="is_sellable" val="false" />
	</item>
	<item id="99027" name="Daily Present - VIP 8" type="EtcItem">
		<!-- Double-click the item to receive 1 Blessed Scroll of Escape, 1 Blessed Scroll of Resurrection, 3 Greater Healing Potions, 150 VIP Coins. -->
		<set name="icon" val="BranchIcon.Icon.etc_vip_present_i06" />
		<set name="default_action" val="PEEL" />
		<set name="immediate_effect" val="true" />
		<set name="material" val="FISH" />
		<set name="is_tradable" val="false" />
		<set name="is_dropable" val="false" />
		<set name="is_sellable" val="false" />
		<set name="is_stackable" val="true" />
		<set name="handler" val="ExtractableItems" />
		<set name="extractableCountMin" val="3" />
		<set name="extractableCountMax" val="3" />
		<capsuled_items>
			<item id="91689" min="1" max="1" chance="100.00" /> <!-- Blessed Scroll of Escape -->
			<item id="3936" min="1" max="1" chance="100.00" /> <!-- Blessed Scroll of Resurrection -->
			<item id="29652" min="3" max="3" chance="100.00" /> <!-- Major Healing Potion -->
		</capsuled_items>
	</item>
	<item id="99028" name="Daily Present - VIP 9" type="EtcItem">
		<!-- Double-click the item to receive 1 Blessed Scroll of Escape, 1 Blessed Scroll of Resurrection, 3 Greater Healing Potions, 150 VIP Coins. -->
		<set name="icon" val="BranchIcon.Icon.etc_vip_present_i06" />
		<set name="default_action" val="PEEL" />
		<set name="immediate_effect" val="true" />
		<set name="material" val="FISH" />
		<set name="is_tradable" val="false" />
		<set name="is_dropable" val="false" />
		<set name="is_sellable" val="false" />
		<set name="is_stackable" val="true" />
		<set name="handler" val="ExtractableItems" />
		<set name="extractableCountMin" val="3" />
		<set name="extractableCountMax" val="3" />
		<capsuled_items>
			<item id="91689" min="1" max="1" chance="100.00" /> <!-- Blessed Scroll of Escape -->
			<item id="3936" min="1" max="1" chance="100.00" /> <!-- Blessed Scroll of Resurrection -->
			<item id="29652" min="3" max="3" chance="100.00" /> <!-- Major Healing Potion -->
		</capsuled_items>
	</item>
	<item id="99029" name="Daily Present - VIP 10" type="EtcItem">
		<!-- Double-click the item to receive 1 Blessed Scroll of Escape, 1 Blessed Scroll of Resurrection, 3 Greater Healing Potions, 150 VIP Coins. -->
		<set name="icon" val="BranchIcon.Icon.etc_vip_present_i06" />
		<set name="default_action" val="PEEL" />
		<set name="immediate_effect" val="true" />
		<set name="material" val="FISH" />
		<set name="is_tradable" val="false" />
		<set name="is_dropable" val="false" />
		<set name="is_sellable" val="false" />
		<set name="is_stackable" val="true" />
		<set name="handler" val="ExtractableItems" />
		<set name="extractableCountMin" val="3" />
		<set name="extractableCountMax" val="3" />
		<capsuled_items>
			<item id="91689" min="1" max="1" chance="100.00" /> <!-- Blessed Scroll of Escape -->
			<item id="3936" min="1" max="1" chance="100.00" /> <!-- Blessed Scroll of Resurrection -->
			<item id="29652" min="3" max="3" chance="100.00" /> <!-- Major Healing Potion -->
		</capsuled_items>
	</item>
</list>
