<?xml version="1.0" encoding="UTF-8"?>
<list xmlns:xsi="http://www.w3.org/2001/XMLSchema-instance" xsi:noNamespaceSchemaLocation="../../xsd/items.xsd">
	<item id="45584" name="Mark of Battle" additionalName="Sealed" type="EtcItem">
		<!-- A reward for the Olympiad achievements. Can be traded for a special gift by Olympiad Managers in any village. -->
		<set name="icon" val="icon.bel_mark_clear" />
		<set name="material" val="CRYSTAL" />
		<set name="is_tradable" val="false" />
		<set name="is_dropable" val="false" />
		<set name="is_sellable" val="false" />
		<set name="is_stackable" val="true" />
	</item>
</list>
