<?xml version="1.0" encoding="UTF-8"?>
<list xmlns:xsi="http://www.w3.org/2001/XMLSchema-instance" xsi:noNamespaceSchemaLocation="../../xsd/items.xsd">
	<item id="30372" name="Hero's Cloak" additionalName="Sealed" type="Armor">
		<!-- Max HP/ MP/ CP +10%, P. Def. +5%, M. Def. +10%, Resistance to All Weapons +5%, P. Critical Rate/ M. Skill Critical Rate +20, Received PvP Damage -10%, Damage Reflection +4%. -->
		<set name="icon" val="icon.vesper_cloack_i00" />
		<set name="default_action" val="EQUIP" />
		<set name="bodypart" val="back" />
		<set name="immediate_effect" val="true" />
		<set name="is_oly_restricted" val="true" />
		<set name="material" val="CLOTH" />
		<set name="weight" val="220" />
		<set name="is_tradable" val="false" />
		<set name="is_dropable" val="false" />
		<set name="is_depositable" val="false" />
		<set name="is_sellable" val="false" />
		<skills>
			<skill id="13136" level="1" /> <!-- Hero's Cloak -->
		</skills>
	</item>
	<item id="30373" name="Glorious Cloak" additionalName="Sealed" type="Armor">
		<!-- Max HP/ MP/ CP +10%, P. Def. +5%, M. Def. +10%, Resistance to All Weapons +5%, P. Critical Rate/ M. Skill Critical Rate +20, Received PvP Damage -10%, Damage Reflection +4%. -->
		<set name="icon" val="icon.vesper_cloack_i00" />
		<set name="default_action" val="EQUIP" />
		<set name="bodypart" val="back" />
		<set name="immediate_effect" val="true" />
		<set name="is_oly_restricted" val="true" />
		<set name="material" val="CLOTH" />
		<set name="weight" val="220" />
		<set name="is_tradable" val="false" />
		<set name="is_dropable" val="false" />
		<set name="is_depositable" val="false" />
		<set name="is_sellable" val="false" />
	</item>
</list>
