<?xml version="1.0" encoding="UTF-8"?>
<list xmlns:xsi="http://www.w3.org/2001/XMLSchema-instance" xsi:noNamespaceSchemaLocation="../../xsd/items.xsd">
	<item id="21566" name="Valkyrie Circlet" additionalName="Event" type="Armor">
		<!-- A circlet holding Valkyrie's strength. Occupies 2 Hair Accessory slots. Cannot be exchanged, dropped, destroyed, or sold. Can be stored in private warehouse. -->
		<set name="icon" val="BranchSys.icon.br_valkyrie_cap_i00" />
		<set name="default_action" val="EQUIP" />
		<set name="bodypart" val="hairall" />
		<set name="immediate_effect" val="true" />
		<set name="material" val="WOOD" />
		<set name="weight" val="10" />
		<set name="is_tradable" val="false" />
		<set name="is_dropable" val="false" />
		<set name="is_depositable" val="false" />
		<set name="is_sellable" val="false" />
		<set name="is_freightable" val="true" />
	</item>
</list>
