<?xml version="1.0" encoding="UTF-8"?>
<list xmlns:xsi="http://www.w3.org/2001/XMLSchema-instance" xsi:noNamespaceSchemaLocation="../../xsd/items.xsd">
	<item id="21713" name="Zaken's Sealed Cloak" type="EtcItem">
		<!-- Increases HP when the seal is released. -->
		<set name="icon" val="icon.sealed_vesper_cloack_i01" />
		<set name="weight" val="220" />
		<set name="price" val="29674485" />
		<set name="is_tradable" val="false" />
		<set name="is_dropable" val="false" />
		<set name="is_sellable" val="false" />
		<set name="material" val="CLOTH" />
	</item>
	<item id="21716" name="Zaken's Cloak" type="Armor">
		<!-- A cloak that makes you feel Zaken's sorrow. Max HP +5%. -->
		<set name="icon" val="BranchSys2.Icon.br_zaken_cloak_i00" />
		<set name="default_action" val="EQUIP" />
		<set name="bodypart" val="back" />
		<set name="immediate_effect" val="true" />
		<set name="material" val="CLOTH" />
		<set name="weight" val="220" />
		<set name="price" val="29674485" />
		<set name="is_tradable" val="false" />
		<set name="is_dropable" val="false" />
		<set name="is_sellable" val="false" />
		<set name="handler" val="ItemSkills" />
		<skills>
			<skill id="45020" level="1" /> <!-- Zaken's Cloak -->
		</skills>
	</item>
	<item id="21754" name="Server Master Magic Pencil" type="Weapon">
		<!-- Magic on the tip of a pencil. A special item for the Head of the server. -->
		<set name="icon" val="BranchSys2.icon.g_pencil_of_servermaster" />
		<set name="default_action" val="EQUIP" />
		<set name="weapon_type" val="POLE" />
		<set name="bodypart" val="lrhand" />
		<set name="immediate_effect" val="true" />
		<set name="material" val="BRONZE" />
		<set name="weight" val="100" />
		<set name="soulshots" val="1" />
		<set name="spiritshots" val="1" />
		<set name="is_tradable" val="false" />
		<set name="is_dropable" val="false" />
		<set name="is_sellable" val="false" />
		<skills>
			<skill id="3599" level="1" /> <!-- Polearm Multi-attack -->
		</skills>
		<stats>
			<stat type="pAtk">1</stat>
			<stat type="rCrit">8</stat>
			<stat type="pAtkSpd">325</stat>
			<stat type="randomDamage">1</stat>
			<stat type="pAtkRange">80</stat>
		</stats>
	</item>
	<item id="21755" name="The Best Graduate's Cope" type="Armor">
		<!-- A Cope with Golden Tassel symbolizing wisdom. -->
		<set name="icon" val="BranchSys2.icon.g_graduation_cap_gold" />
		<set name="default_action" val="EQUIP" />
		<set name="bodypart" val="hairall" />
		<set name="immediate_effect" val="true" />
		<set name="material" val="WOOD" />
		<set name="weight" val="10" />
		<set name="is_tradable" val="false" />
		<set name="is_dropable" val="false" />
		<set name="is_sellable" val="false" />
	</item>
</list>
